,items,comp
180,"Gross fixed capital formation, private sector (current LCU)",0.0061438363045454025
142,GNI (current US$),0.006556704640388489
182,Gross national expenditure (constant 2010 US$),0.006600638851523399
860,"Prevalence of wasting, weight for height, male (% of children under 5)",0.006692353170365095
1102,Logistics performance index: Frequency with which shipments reach consignee within scheduled or expected time (1=low to 5=high),0.006745997816324234
914,"Trademark applications, resident, by count",0.0074946582317352295
1135,"Share of tariff lines with international peaks, all products (%)",0.007588827982544899
1069,Commercial service exports (current US$),0.007658894173800945
126,GDP (current US$),0.007743966765701771
168,Gross capital formation (current US$),0.008747825399041176
539,"People using at least basic sanitation services, rural (% of rural population)",0.009371651336550713
196,Households and NPISHs Final consumption expenditure (constant 2010 US$),0.00970415212213993
907,"Quality of port infrastructure, WEF (1=extremely underdeveloped to 7=well developed and efficient by international standards)",0.009752359241247177
705,"Age dependency ratio, old (% of working-age population)",0.00981190800666809
1093,"International tourism, receipts (current US$)",0.009956825524568558
843,Prevalence of anemia among children (% of children under 5),0.010405030101537704
899,Investment in transport with private participation (current US$),0.010819858871400356
615,Births attended by skilled health staff (% of total),0.010879002511501312
602,Public credit registry coverage (% of adults),0.010902781039476395
891,Fixed telephone subscriptions,0.010982397943735123
299,"Children out of school, primary",0.010996483266353607
820,"Population ages 60-64, female (% of female population)",0.011896798387169838
36,Rural land area where elevation is below 5 meters (sq. km),0.01195068284869194
58,Adjusted savings: consumption of fixed capital (% of GNI),0.012190228328108788
805,"Population ages 25-29, male (% of male population)",0.012283526360988617
795,"Population ages 15-19, female (% of female population)",0.012436079792678356
486,Total natural resources rents (% of GDP),0.012492774054408073
95,"Exports of goods and services (BoP, current US$)",0.012677058577537537
581,Deposit interest rate (%),0.012706093490123749
193,Gross value added at basic prices (GVA) (current LCU),0.012857903726398945
798,"Population ages 15-64, female (% of total)",0.013151012361049652
520,"Mortality rate attributed to household and ambient air pollution, age-standardized (per 100,000 population)",0.01349005289375782
463,Energy related methane emissions (% of total),0.013675380498170853
772,Number of infant deaths,0.014088623225688934
1165,Population in urban agglomerations of more than 1 million,0.014256980270147324
897,"Industrial design applications, resident, by count",0.014455854892730713
824,"Population ages 65 and above, female (% of total)",0.014785878360271454
752,"Incidence of malaria (per 1,000 population at risk)",0.014985410496592522
298,"Children out of school, male (% of male primary school age)",0.01527592446655035
344,"Literacy rate, adult female (% of females ages 15 and above)",0.015315553173422813
1089,"International tourism, expenditures for travel items (current US$)",0.015539473854005337
762,"Mortality rate attributed to household and ambient air pollution, age-standardized, male (per 100,000 male population)",0.015629027038812637
918,Adequacy of unemployment benefits and ALMP (% of total welfare of beneficiary households),0.015836190432310104
390,"Repeaters, primary, total (% of total enrollment)",0.016413623467087746
1094,"International tourism, receipts for passenger transport items (current US$)",0.016497410833835602
261,"Primary income payments (BoP, current US$)",0.016902253031730652
531,"PM2.5 air pollution, population exposed to levels exceeding WHO guideline value (% of total)",0.01700614020228386
618,"Child employment in manufacturing, female (% of female economically active children ages 7-14)",0.017017774283885956
97,Exports of goods and services (constant 2010 US$),0.017131131142377853
964,"Employers, total (% of total employment) (modeled ILO estimate)",0.01718302071094513
632,"Contributing family workers, male (% of male employment) (modeled ILO estimate)",0.01755911484360695
267,"Service exports (BoP, current US$)",0.017822861671447754
900,Investment in water and sanitation with private participation (current US$),0.017963381484150887
835,"Population ages 80 and above, male (% of male population)",0.018327198922634125
348,"Literacy rate, youth female (% of females ages 15-24)",0.018543926998972893
600,"Portfolio investment, bonds (PPG + PNG) (NFL, current US$)",0.019018394872546196
213,Imports of goods and services (current US$),0.019022518768906593
160,"Goods exports (BoP, current US$)",0.020249605178833008
649,Law mandates equal remuneration for females and males for work of equal value (1=yes; 0=no),0.02066974714398384
1108,Merchandise exports by the reporting economy (current US$),0.02117043361067772
1088,"International tourism, expenditures for passenger transport items (current US$)",0.021407991647720337
178,Gross fixed capital formation (current US$),0.021664917469024658
692,Women who believe a husband is justified in beating his wife (any of five reasons) (%),0.0222617294639349
901,Liner shipping connectivity index (maximum value in 2004 = 100),0.02262132428586483
793,"Population ages 10-14, female (% of female population)",0.02333195134997368
283,Total reserves minus gold (current US$),0.023371431976556778
165,Gross capital formation (constant 2010 US$),0.02416217140853405
139,GNI (constant 2010 US$),0.02418985217809677
1055,Scientific and technical journal articles,0.024347279220819473
75,"Agriculture, forestry, and fishing, value added (constant 2010 US$)",0.024541961029171944
822,Population ages 65 and above (% of total),0.024698268622159958
593,"Listed domestic companies, total",0.024794159457087517
826,"Population ages 65 and above, male (% of total)",0.025158293545246124
152,"GNI, PPP (constant 2011 international $)",0.025456391274929047
700,Women's share of population ages 15+ living with HIV (%),0.026084743440151215
388,"Repeaters, primary, female (% of female enrollment)",0.02620863728225231
233,"Manufacturing, value added (current US$)",0.02658025175333023
417,"Secondary education, general pupils (% female)",0.027047164738178253
628,"Condom use, population ages 15-24, female (% of females ages 15-24)",0.028287842869758606
823,"Population ages 65 and above, female",0.028432590886950493
549,"People with basic handwashing facilities including soap and water, urban (% of urban population)",0.029068544507026672
80,Changes in inventories (current LCU),0.029110286384820938
346,"Literacy rate, adult total (% of people ages 15 and above)",0.029179725795984268
111,Final consumption expenditure (constant 2010 US$),0.02938484586775303
903,Mobile cellular subscriptions (per 100 people),0.029431317001581192
151,"GNI, Atlas method (current US$)",0.02948756143450737
159,General government final consumption expenditure (current US$),0.029768988490104675
827,"Population ages 65 and above, total",0.030467098578810692
543,"People using safely managed drinking water services, urban (% of urban population)",0.03051728382706642
297,"Children out of school, female (% of female primary school age)",0.030617397278547287
347,"Literacy rate, youth (ages 15-24), gender parity index (GPI)",0.030684540048241615
76,"Agriculture, forestry, and fishing, value added (constant LCU)",0.031158853322267532
1050,High-technology exports (current US$),0.03195957839488983
928,Benefit incidence of unemployment benefits and ALMP to poorest quintile (% of total U/ALMP benefits),0.03204666078090668
420,"Secondary education, teachers",0.03216906636953354
637,"Employment in services, female (% of female employment) (modeled ILO estimate)",0.03235885873436928
294,"Adolescents out of school, female (% of female lower secondary school age)",0.033016387373209
1034,Income share held by lowest 20%,0.03360946103930473
831,"Population ages 70-74, male (% of male population)",0.03372378647327423
538,People using at least basic sanitation services (% of population),0.03388386592268944
565,"Automated teller machines (ATMs) (per 100,000 adults)",0.03392244875431061
349,"Literacy rate, youth male (% of males ages 15-24)",0.03406154736876488
958,Coverage of unemployment benefits and ALMP (% of population),0.034429315477609634
418,"Secondary education, pupils",0.03490152209997177
1163,Population in largest city,0.0352422334253788
357,"Net intake rate in grade 1, male (% of official school-age population)",0.03548431769013405
537,"People using at least basic drinking water services, urban (% of urban population)",0.035716764628887177
841,"Population, total",0.036015789955854416
1057,"Trademark applications, direct nonresident",0.03640930354595184
810,"Population ages 40-44, female (% of female population)",0.03656372055411339
1087,"International tourism, expenditures (current US$)",0.036776069551706314
137,"GDP, PPP (current international $)",0.03694595769047737
262,"Primary income receipts (BoP, current US$)",0.03707406669855118
1095,"International tourism, receipts for travel items (current US$)",0.03757698833942413
707,Antiretroviral therapy coverage (% of people living with HIV),0.03759857639670372
782,Out-of-pocket expenditure (% of current health expenditure),0.037728987634181976
230,"Manufacturing, value added (constant 2010 US$)",0.03773532435297966
1075,"Cost to import, border compliance (US$)",0.0377538837492466
1120,Merchandise imports (current US$),0.03784159570932388
1100,Logistics performance index: Ease of arranging competitively priced shipments (1=low to 5=high),0.038044217973947525
345,"Literacy rate, adult male (% of males ages 15 and above)",0.038102611899375916
472,Investment in energy with private participation (current US$),0.03830254450440407
608,"Stocks traded, total value (current US$)",0.03833158686757088
1136,"Share of tariff lines with international peaks, manufactured products (%)",0.03872460871934891
171,Gross domestic savings (current LCU),0.03872990608215332
153,"GNI, PPP (current international $)",0.039132073521614075
872,"Specialist surgical workforce (per 100,000 population)",0.03942159563302994
90,Discrepancy in expenditure estimate of GDP (constant LCU),0.03950881585478783
740,Domestic private health expenditure per capita (current US$),0.03952435776591301
296,Children out of school (% of primary school age),0.03968191519379616
238,"Net financial account (BoP, current US$)",0.040129292756319046
1146,"Tariff rate, applied, weighted mean, primary products (%)",0.04019872099161148
832,"Population ages 75-79, female (% of female population)",0.040780484676361084
167,Gross capital formation (current LCU),0.040814295411109924
1059,"Trademark applications, total",0.0410178005695343
156,General government final consumption expenditure (constant 2010 US$),0.041086141020059586
101,"Exports of goods, services and primary income (BoP, current US$)",0.041433438658714294
525,Nitrous oxide emissions (% change from 1990),0.041854627430438995
246,Net secondary income (Net current transfers from abroad) (current LCU),0.041870322078466415
886,"Air transport, passengers carried",0.04215792566537857
562,Urban land area where elevation is below 5 meters (sq. km),0.04291434958577156
912,Secure Internet servers (per 1 million people),0.042918913066387177
217,"Industry (including construction), value added (constant 2010 US$)",0.04300674796104431
902,Mobile cellular subscriptions,0.04319554567337036
750,"Immunization, measles (% of children ages 12-23 months)",0.043512195348739624
175,Gross fixed capital formation (constant 2010 US$),0.04388953372836113
115,Financial intermediary services indirectly Measured (FISIM) (constant LCU),0.044002097100019455
542,"People using safely managed drinking water services, rural (% of rural population)",0.04403376206755638
609,"Stocks traded, turnover ratio of domestic shares (%)",0.04449092596769333
203,"Households and NPISHs Final consumption expenditure, PPP (current international $)",0.045111753046512604
960,Coverage of unemployment benefits and ALMP in 3rd quintile (% of population),0.04525188356637955
687,"Wage and salaried workers, female (% of female employment) (modeled ILO estimate)",0.045625150203704834
322,"Educational attainment, at least completed primary, population 25+ years, female (%) (cumulative)",0.04576326534152031
777,Number of people spending more than 10% of household consumption or income on out-of-pocket health care expenditure,0.045827098190784454
295,"Adolescents out of school, male (% of male lower secondary school age)",0.04613245278596878
759,"Mortality from CVD, cancer, diabetes or CRD between exact ages 30 and 70, female (%)",0.046600744128227234
88,"Current account balance (BoP, current US$)",0.04699501395225525
800,"Population ages 15-64, male (% of total)",0.0474163182079792
1121,Merchandise imports by the reporting economy (current US$),0.04772119224071503
220,"Industry (including construction), value added (current US$)",0.04823681712150574
614,"Adolescent fertility rate (births per 1,000 women ages 15-19)",0.04843059182167053
506,CO2 emissions from solid fuel consumption (kt),0.04884202033281326
727,Current health expenditure (% of GDP),0.04950354993343353
989,"Labor force participation rate, male (% of male population ages 15-64) (modeled ILO estimate)",0.051080372184515
1026,"Wage and salaried workers, total (% of total employment) (modeled ILO estimate)",0.052193403244018555
422,"Secondary education, teachers, female",0.05314840003848076
350,"Literacy rate, youth total (% of people ages 15-24)",0.05330100655555725
1167,Urban population,0.05337987467646599
778,Number of people spending more than 25% of household consumption or income on out-of-pocket health care expenditure,0.0535145066678524
694,Women who believe a husband is justified in beating his wife when she burns the food (%),0.05358142405748367
801,"Population ages 15-64, total",0.054140131920576096
913,"Trademark applications, nonresident, by count",0.05460337921977043
734,Domestic general government health expenditure (% of GDP),0.05483226478099823
210,Imports of goods and services (constant 2010 US$),0.05483820289373398
423,"Secondary education, vocational pupils",0.05484741926193237
780,Number of under-five deaths,0.05541287362575531
797,"Population ages 15-64, female",0.05571606755256653
951,Coverage of social protection and labor programs (% of population),0.05573190748691559
163,Gross capital formation (% of GDP),0.055887192487716675
161,"Goods imports (BoP, current US$)",0.05593327432870865
1091,"International tourism, number of departures",0.05618056654930115
736,Domestic general government health expenditure (% of general government expenditure),0.05626826733350754
833,"Population ages 75-79, male (% of male population)",0.056628987193107605
343,"Labor force, total",0.057486750185489655
477,Nitrous oxide emissions in energy sector (thousand metric tons of CO2 equivalent),0.05847611650824547
1047,Urban poverty gap at national poverty lines (%),0.058843523263931274
1058,"Trademark applications, direct resident",0.06006263568997383
136,"GDP, PPP (constant 2011 international $)",0.060430217534303665
500,CO2 emissions from gaseous fuel consumption (kt),0.060971733182668686
125,GDP (current LCU),0.06100095063447952
497,CO2 emissions (kt),0.06127922236919403
70,Adjusted savings: net national savings (% of GNI),0.06142021715641022
1060,Arms exports (SIPRI trend indicator values),0.06142975017428398
219,"Industry (including construction), value added (current LCU)",0.061522550880908966
140,GNI (constant LCU),0.06155882403254509
416,"Secondary education, general pupils",0.06218797340989113
519,Methane emissions (kt of CO2 equivalent),0.06334728002548218
1079,Export volume index (2000 = 100),0.06348883360624313
933,"Children in employment, self-employed, female (% of female children in employment, ages 7-14)",0.06358635425567627
241,Net primary income (Net income from abroad) (constant LCU),0.06378304958343506
308,"Educational attainment, Doctoral or equivalent, population 25+, male (%) (cumulative)",0.06420190632343292
499,"CO2 emissions from electricity and heat production, total (% of total fuel combustion)",0.0644495040178299
839,"Population, male",0.06516413390636444
177,Gross fixed capital formation (current LCU),0.0651722401380539
597,Net foreign assets (current LCU),0.06548627465963364
7,Agricultural methane emissions (thousand metric tons of CO2 equivalent),0.06558368355035782
176,Gross fixed capital formation (constant LCU),0.06568334996700287
324,"Educational attainment, at least completed primary, population 25+ years, total (%) (cumulative)",0.0665438175201416
547,People with basic handwashing facilities including soap and water (% of population),0.06656211614608765
859,"Prevalence of wasting, weight for height, female (% of children under 5)",0.06677848100662231
138,GDP: linked series (current LCU),0.06696195155382156
279,Textiles and clothing (% of value added in manufacturing),0.0670812800526619
31,Land under cereal production (hectares),0.06711408495903015
591,"International migrant stock, total",0.06778925657272339
758,"Mortality from CVD, cancer, diabetes or CRD between exact ages 30 and 70 (%)",0.06804069876670837
799,"Population ages 15-64, male",0.06825509667396545
1097,"Lead time to import, median case (days)",0.06860772520303726
559,Total greenhouse gas emissions (kt of CO2 equivalent),0.06866032630205154
268,"Service imports (BoP, current US$)",0.06954886764287949
908,Rail lines (total route-km),0.07000881433486938
209,Imports of goods and services (annual % growth),0.07014214247465134
828,"Population ages 65-69, female (% of female population)",0.07016588002443314
560,Urban land area (sq. km),0.07016902416944504
888,Container port traffic (TEU: 20 foot equivalent units),0.07100051641464233
1051,"Patent applications, nonresidents",0.07265350967645645
804,"Population ages 25-29, female (% of female population)",0.07285679876804352
688,"Wage and salaried workers, male (% of male employment) (modeled ILO estimate)",0.07293406128883362
197,Households and NPISHs Final consumption expenditure (constant LCU),0.07304471731185913
116,Financial intermediary services indirectly Measured (FISIM) (current LCU),0.07392274588346481
786,"Population ages 0-14, female",0.07423236966133118
682,Teenage mothers (% of women ages 15-19 who have had children or are currently pregnant),0.07452625036239624
255,"Personal remittances, received (current US$)",0.07467782497406006
198,Households and NPISHs Final consumption expenditure (current LCU),0.07513388991355896
119,"Foreign direct investment, net inflows (% of GDP)",0.07525408267974854
1105,Manufactures exports (% of merchandise exports),0.07645697146654129
573,Broad money to total reserves ratio,0.07647331058979034
135,"GDP per capita, PPP (current international $)",0.07655947655439377
389,"Repeaters, primary, male (% of male enrollment)",0.07709933817386627
150,"GNI per capita, PPP (current international $)",0.07869605720043182
192,Gross value added at basic prices (GVA) (constant LCU),0.07950317114591599
790,"Population ages 0-14, total",0.07986143231391907
487,Value lost due to electrical outages (% of sales for affected firms),0.07992781698703766
149,"GNI per capita, PPP (constant 2011 international $)",0.08024603128433228
376,"Primary education, teachers",0.08104317635297775
788,"Population ages 0-14, male",0.08111263811588287
548,"People with basic handwashing facilities including soap and water, rural (% of rural population)",0.08125671744346619
231,"Manufacturing, value added (constant LCU)",0.08170934021472931
697,Women who believe a husband is justified in beating his wife when she refuses sex with him (%),0.08207711577415466
837,"Population, female",0.08213198930025101
179,"Gross fixed capital formation, private sector (% of GDP)",0.08300121128559113
184,Gross national expenditure (current LCU),0.08338697254657745
582,"Depositors with commercial banks (per 1,000 adults)",0.08496361970901489
379,Progression to secondary school (%),0.08616475760936737
887,"Air transport, registered carrier departures worldwide",0.08629964292049408
37,Rural population,0.08654873818159103
141,GNI (current LCU),0.08669225871562958
461,"Energy imports, net (% of energy use)",0.08670166879892349
1147,"Tariff rate, most favored nation, simple mean, all products (%)",0.08691132068634033
448,CO2 emissions from liquid fuel consumption (kt),0.08720836043357849
134,"GDP per capita, PPP (constant 2011 international $)",0.08730839937925339
1035,Income share held by second 20%,0.08735443651676178
1142,"Tariff rate, applied, simple mean, manufactured products (%)",0.08743229508399963
113,Final consumption expenditure (current LCU),0.08771875500679016
1078,Export value index (2000 = 100),0.08791572600603104
830,"Population ages 70-74, female (% of female population)",0.08812364935874939
916,Adequacy of social protection and labor programs (% of total welfare of beneficiary households),0.08847984671592712
922,"Average working hours of children, working only, ages 7-14 (hours per week)",0.08875779062509537
770,Newborns protected against tetanus (%),0.08884131908416748
774,Number of neonatal deaths,0.0891149491071701
966,Employment in services (% of total employment) (modeled ILO estimate),0.08966588228940964
910,"Railways, passengers carried (million passenger-km)",0.09017761051654816
1052,"Patent applications, residents",0.09040100127458572
429,Trained teachers in preprimary education (% of total teachers),0.09082680940628052
1141,"Tariff rate, applied, simple mean, all products (%)",0.09083161503076553
124,GDP (constant LCU),0.09138256311416626
811,"Population ages 40-44, male (% of male population)",0.09226962924003601
3,Agricultural land (sq. km),0.09272298961877823
940,"Children in employment, wage workers (% of children in employment, ages 7-14)",0.09327951818704605
269,"Services, value added (% of GDP)",0.09344583004713058
19,Cereal production (metric tons),0.0952216237783432
775,Number of people pushed below the $1.90 ($ 2011 PPP) poverty line by out-of-pocket health care expenditure,0.0964273065328598
554,SF6 gas emissions (thousand metric tons of CO2 equivalent),0.09789383411407471
607,"Stocks traded, total value (% of GDP)",0.09802255779504776
634,"Employers, male (% of male employment) (modeled ILO estimate)",0.09873198717832565
26,Fertilizer consumption (kilograms per hectare of arable land),0.09898047894239426
263,"Reserves and related items (BoP, current US$)",0.0991721898317337
202,"Households and NPISHs Final consumption expenditure, PPP (constant 2011 international $)",0.10004841536283493
169,Gross domestic income (constant LCU),0.10023249685764313
488,Access to clean fuels and technologies for cooking (% of population),0.10056009888648987
103,External balance on goods and services (constant LCU),0.10092629492282867
183,Gross national expenditure (constant LCU),0.10274550318717957
247,Net secondary income (Net current transfers from abroad) (current US$),0.10275939106941223
536,"People using at least basic drinking water services, rural (% of rural population)",0.1028832346200943
586,Domestic credit to private sector by banks (% of GDP),0.10321813821792603
712,"Cause of death, by non-communicable diseases (% of total)",0.10474972426891327
535,People using at least basic drinking water services (% of population),0.10508986562490463
451,Electric power consumption (kWh per capita),0.10524717718362808
245,Net secondary income (Net current transfers from abroad) (constant LCU),0.10567353665828705
380,"Progression to secondary school, female (%)",0.10618051141500473
882,Unmet need for contraception (% of married women ages 15-49),0.10687504708766937
695,Women who believe a husband is justified in beating his wife when she goes out without telling him (%),0.10692708194255829
585,Domestic credit to private sector (% of GDP),0.10704335570335388
1148,"Tariff rate, most favored nation, simple mean, manufactured products (%)",0.1071343943476677
654,"Life expectancy at birth, female (years)",0.1076149046421051
595,Market capitalization of listed domestic companies (current US$),0.10874319821596146
701,ARI treatment (% of children under 5 taken to a health provider),0.10935410857200623
825,"Population ages 65 and above, male",0.11148197948932648
845,Prevalence of anemia among pregnant women (%),0.11242625117301941
232,"Manufacturing, value added (current LCU)",0.11248694360256195
218,"Industry (including construction), value added (constant LCU)",0.11298002302646637
323,"Educational attainment, at least completed primary, population 25+ years, male (%) (cumulative)",0.11305771768093109
10,Agricultural raw materials exports (% of merchandise exports),0.11374799907207489
157,General government final consumption expenditure (constant LCU),0.11417131125926971
896,"Industrial design applications, nonresident, by count",0.11474218964576721
629,"Condom use, population ages 15-24, male (% of males ages 15-24)",0.11490906029939651
381,"Progression to secondary school, male (%)",0.1149127259850502
961,Coverage of unemployment benefits and ALMP in 4th quintile (% of population),0.11508961021900177
783,Out-of-pocket expenditure per capita (current US$),0.11606870591640472
293,Adolescents out of school (% of lower secondary school age),0.11622798442840576
776,Number of people pushed below the $3.10 ($ 2011 PPP) poverty line by out-of-pocket health care expenditure,0.11669115722179413
858,"Prevalence of wasting, weight for height (% of children under 5)",0.11707872897386551
1117,Merchandise exports to low- and middle-income economies in Sub-Saharan Africa (% of total merchandise exports),0.11786696314811707
