,items,comp
453,Electricity production from coal sources (% of total),-0.15792515873908997
1122,"Merchandise imports by the reporting economy, residual (% of total merchandise imports)",-0.15768560767173767
412,"School enrollment, tertiary (gross), gender parity index (GPI)",-0.15598246455192566
894,ICT goods imports (% total goods imports),-0.15551021695137024
1155,"Time to export, documentary compliance (hours)",-0.1550447791814804
205,"ICT service exports (% of service exports, BoP)",-0.1546550989151001
650,Law mandates nondiscrimination based on gender in hiring (1=yes; 0=no),-0.15428173542022705
270,"Services, value added (annual % growth)",-0.15384024381637573
1002,"Part time employment, total (% of total employment)",-0.15301765501499176
14,"Annual freshwater withdrawals, agriculture (% of total freshwater withdrawal)",-0.15199416875839233
528,"Other greenhouse gas emissions, HFC, PFC and SF6 (thousand metric tons of CO2 equivalent)",-0.1518237590789795
289,"Travel services (% of service imports, BoP)",-0.14884546399116516
1096,"Lead time to export, median case (days)",-0.1481485664844513
855,"Prevalence of stunting, height for age, male (% of children under 5)",-0.14492423832416534
320,"Educational attainment, at least completed post-secondary, population 25+, male (%) (cumulative)",-0.14363941550254822
41,Rural poverty gap at national poverty lines (%),-0.14327770471572876
766,"Mortality rate, neonatal (per 1,000 live births)",-0.14265935122966766
59,Adjusted savings: consumption of fixed capital (current US$),-0.1408403068780899
371,"Primary completion rate, male (% of relevant age group)",-0.1407584547996521
399,"School enrollment, primary, female (% net)",-0.1391235589981079
372,"Primary completion rate, total (% of relevant age group)",-0.13866978883743286
396,"School enrollment, primary (gross), gender parity index (GPI)",-0.1384279876947403
854,"Prevalence of stunting, height for age, female (% of children under 5)",-0.13821479678153992
739,Domestic private health expenditure (% of current health expenditure),-0.1382012516260147
512,"Droughts, floods, extreme temperatures (% of population, average 1990-2009)",-0.1380791962146759
360,"Over-age students, primary, male (% of male enrollment)",-0.13649384677410126
1056,Technicians in R&D (per million people),-0.13606560230255127
314,"Educational attainment, at least Master's or equivalent, population 25+, male (%) (cumulative)",-0.13470372557640076
382,"Pupil-teacher ratio, lower secondary",-0.1345979869365692
781,"Nurses and midwives (per 1,000 people)",-0.13446326553821564
313,"Educational attainment, at least Master's or equivalent, population 25+, female (%) (cumulative)",-0.13386034965515137
545,"People using safely managed sanitation services, rural (% of rural population)",-0.13308845460414886
1053,Research and development expenditure (% of GDP),-0.13248050212860107
927,Benefit incidence of social safety net programs to poorest quintile (% of total safety net benefits),-0.13070526719093323
767,"Mortality rate, under-5 (per 1,000 live births)",-0.12931698560714722
1038,Poverty gap at $3.20 a day (2011 PPP) (%),-0.12801054120063782
38,Rural population (% of total population),-0.12770643830299377
61,Adjusted savings: education expenditure (current US$),-0.12623107433319092
959,Coverage of unemployment benefits and ALMP in 2nd quintile (% of population),-0.12601372599601746
599,"Official exchange rate (LCU per US$, period average)",-0.12601137161254883
476,Nitrous oxide emissions in energy sector (% of total),-0.12428313493728638
763,"Mortality rate, infant (per 1,000 live births)",-0.1239313930273056
1101,Logistics performance index: Efficiency of customs clearance process (1=low to 5=high),-0.12390421330928802
689,Wanted fertility rate (births per woman),-0.12366460263729095
82,"Charges for the use of intellectual property, payments (BoP, current US$)",-0.1229868084192276
699,Women who were first married by age 18 (% of women ages 20-24),-0.12292202562093735
769,"Mortality rate, under-5, male (per 1,000 live births)",-0.12231643497943878
419,"Secondary education, pupils (% female)",-0.12212103605270386
1041,Poverty headcount ratio at $1.90 a day (2011 PPP) (% of population),-0.12143798917531967
652,Law prohibits or invalidates child or early marriage (1=yes; 0=no),-0.12134288251399994
401,"School enrollment, primary, male (% net)",-0.11991486698389053
1152,"Tariff rate, most favored nation, weighted mean, primary products (%)",-0.11939346045255661
857,"Prevalence of underweight, weight for age (% of children under 5)",-0.11933226883411407
1029,GINI index (World Bank estimate),-0.11854816228151321
765,"Mortality rate, infant, male (per 1,000 live births)",-0.1181153878569603
1104,Logistics performance index: Quality of trade and transport-related infrastructure (1=low to 5=high),-0.11797737330198288
333,Expenditure on tertiary education (% of government expenditure on education),-0.11767823249101639
24,"Employment in agriculture, male (% of male employment) (modeled ILO estimate)",-0.1158362329006195
670,"Prevalence of underweight, weight for age, female (% of children under 5)",-0.11465254426002502
1133,Merchandise trade (% of GDP),-0.11402340233325958
1164,Population in the largest city (% of urban population),-0.11235827207565308
144,GNI per capita (constant 2010 US$),-0.11203110963106155
133,GDP per capita growth (annual %),-0.1115906685590744
1001,"Labor force with intermediate education, male (% of male working-age population with intermediate education)",-0.11149574816226959
657,Lifetime risk of maternal death (1 in: rate varies by country),-0.11115337163209915
328,"Educational attainment, at least completed upper secondary, population 25+, female (%) (cumulative)",-0.11114425957202911
728,Current health expenditure per capita (current US$),-0.10965655744075775
29,Forest area (sq. km),-0.10879041254520416
93,Exports as a capacity to import (constant LCU),-0.10800541192293167
211,Imports of goods and services (constant LCU),-0.10756832361221313
98,Exports of goods and services (constant LCU),-0.10608623921871185
128,GDP growth (annual %),-0.10472454130649567
99,Exports of goods and services (current LCU),-0.10344033688306808
764,"Mortality rate, infant, female (per 1,000 live births)",-0.10343687236309052
490,"Annual freshwater withdrawals, industry (% of total freshwater withdrawal)",-0.10303942859172821
307,"Educational attainment, Doctoral or equivalent, population 25+, female (%) (cumulative)",-0.10272172093391418
1076,"Cost to import, documentary compliance (US$)",-0.10261019319295883
862,Proportion of population pushed below the $1.90 ($ 2011 PPP) poverty line by out-of-pocket health care expenditure (%),-0.1026047021150589
773,Number of maternal deaths,-0.10183298587799072
22,Employment in agriculture (% of total employment) (modeled ILO estimate),-0.10148836672306061
1137,"Share of tariff lines with international peaks, primary products (%)",-0.10059082508087158
356,"Net intake rate in grade 1, female (% of official school-age population)",-0.10044573247432709
768,"Mortality rate, under-5, female (per 1,000 live births)",-0.09990929067134857
1025,"Vulnerable employment, total (% of total employment) (modeled ILO estimate)",-0.09880569577217102
23,"Employment in agriculture, female (% of female employment) (modeled ILO estimate)",-0.09858083724975586
63,Adjusted savings: energy depletion (current US$),-0.09745939075946808
242,Net primary income (Net income from abroad) (current LCU),-0.0964093804359436
315,"Educational attainment, at least Master's or equivalent, population 25+, total (%) (cumulative)",-0.0962577760219574
1066,"Bound rate, simple mean, all products (%)",-0.09619881212711334
601,Private credit bureau coverage (% of adults),-0.09605828672647476
395,"School enrollment, primary (% net)",-0.09549415111541748
129,GDP per capita (constant 2010 US$),-0.09422485530376434
677,"Self-employed, male (% of male employment) (modeled ILO estimate)",-0.09367574751377106
644,"Fertility rate, total (births per woman)",-0.09366190433502197
67,Adjusted savings: natural resources depletion (% of GNI),-0.09325532615184784
273,Short-term debt (% of total reserves),-0.09299660474061966
643,Female headed households (% of households with a female head),-0.09258238226175308
1098,Logistics performance index: Ability to track and trace consignments (1=low to 5=high),-0.09130501747131348
148,"GNI per capita, Atlas method (current US$)",-0.09086304903030396
529,PFC gas emissions (thousand metric tons of CO2 equivalent),-0.0905618965625763
571,Broad money (current LCU),-0.08919896185398102
331,Expenditure on primary education (% of government expenditure on education),-0.0890544131398201
370,"Primary completion rate, female (% of relevant age group)",-0.08756131678819656
630,"Contraceptive prevalence, any methods (% of women ages 15-49)",-0.08750112354755402
1131,Merchandise imports from low- and middle-income economies outside region (% of total merchandise imports),-0.08745750784873962
883,Use of insecticide-treated bed nets (% of under-5 population),-0.08620398491621017
188,Gross savings (% of GNI),-0.08581127971410751
686,"Vulnerable employment, male (% of male employment) (modeled ILO estimate)",-0.08569809794425964
1039,Poverty gap at $5.50 a day (2011 PPP) (%),-0.0856570303440094
330,"Educational attainment, at least completed upper secondary, population 25+, total (%) (cumulative)",-0.08489037305116653
676,"Self-employed, female (% of female employment) (modeled ILO estimate)",-0.08443633466959
316,"Educational attainment, at least completed lower secondary, population 25+, female (%) (cumulative)",-0.08369976282119751
803,"Population ages 20-24, male (% of male population)",-0.08326795697212219
1140,"Share of tariff lines with specific rates, primary products (%)",-0.08188769221305847
709,"Birth rate, crude (per 1,000 people)",-0.08127310872077942
671,"Prevalence of underweight, weight for age, male (% of children under 5)",-0.08052720129489899
696,Women who believe a husband is justified in beating his wife when she neglects the children (%),-0.08036412298679352
1046,"Survey mean consumption or income per capita, total population (2011 PPP $ per day)",-0.08014165610074997
311,"Educational attainment, at least Bachelor's or equivalent, population 25+, male (%) (cumulative)",-0.07975831627845764
455,Electricity production from natural gas sources (% of total),-0.07934583723545074
64,Adjusted savings: gross savings (% of GNI),-0.0779171735048294
1054,Researchers in R&D (per million people),-0.07632789760828018
498,CO2 emissions (metric tons per capita),-0.07590141892433167
834,"Population ages 80 and above, female (% of female population)",-0.0756082534790039
941,"Children in employment, wage workers, female (% of female children in employment, ages 7-14)",-0.07494257390499115
278,Terms of trade adjustment (constant LCU),-0.0744360163807869
937,"Children in employment, unpaid family workers (% of children in employment, ages 7-14)",-0.07443004101514816
659,"Maternal mortality ratio (national estimate, per 100,000 live births)",-0.07383869588375092
260,"Primary income on FDI, payments (current US$)",-0.07283952087163925
796,"Population ages 15-19, male (% of male population)",-0.07245714962482452
403,"School enrollment, secondary (% gross)",-0.07174745947122574
1042,Poverty headcount ratio at $3.20 a day (2011 PPP) (% of population),-0.07094880938529968
957,Coverage of social safety net programs in richest quintile (% of population),-0.0707523450255394
685,"Vulnerable employment, female (% of female employment) (modeled ILO estimate)",-0.06990082561969757
1099,Logistics performance index: Competence and quality of logistics services (1=low to 5=high),-0.06969727575778961
761,"Mortality rate attributed to household and ambient air pollution, age-standardized, female (per 100,000 female population)",-0.06959744542837143
359,"Over-age students, primary, female (% of female enrollment)",-0.06952554732561111
737,Domestic general government health expenditure per capita (current US$),-0.06901382654905319
1123,Merchandise imports from economies in the Arab World (% of total merchandise imports),-0.06804883480072021
1012,Unemployment with basic education (% of total labor force with basic education),-0.06734130531549454
404,"School enrollment, secondary (% net)",-0.06732871383428574
785,"Physicians (per 1,000 people)",-0.06631395220756531
274,Taxes less subsidies on products (constant LCU),-0.06625312566757202
351,"Lower secondary completion rate, female (% of relevant age group)",-0.06619327515363693
407,"School enrollment, secondary, female (% net)",-0.06590410321950912
895,Individuals using the Internet (% of population),-0.06570803374052048
318,"Educational attainment, at least completed lower secondary, population 25+, total (%) (cumulative)",-0.0656949058175087
1154,"Time to export, border compliance (hours)",-0.06535416096448898
747,"Hospital beds (per 1,000 people)",-0.0641593411564827
385,"Pupil-teacher ratio, secondary",-0.0636870265007019
414,"School enrollment, tertiary, male (% gross)",-0.06342484056949615
406,"School enrollment, secondary, female (% gross)",-0.0634090006351471
212,Imports of goods and services (current LCU),-0.06337566673755646
881,UHC service coverage index,-0.0631154328584671
57,Adjusted savings: carbon dioxide damage (current US$),-0.06230122596025467
466,Firms using banks to finance investment (% of firms),-0.061405617743730545
258,"Portfolio investment, net (BoP, current US$)",-0.06126490235328674
411,"School enrollment, tertiary (% gross)",-0.061085909605026245
816,"Population ages 50-54, female (% of female population)",-0.06077822297811508
62,Adjusted savings: energy depletion (% of GNI),-0.05961204692721367
353,"Lower secondary completion rate, total (% of relevant age group)",-0.059154268354177475
291,"Adjusted net enrollment rate, primary, female (% of primary school age children)",-0.058650970458984375
792,"Population ages 0-4, male (% of male population)",-0.057966381311416626
51,Adjusted net national income per capita (current US$),-0.05585624277591705
509,Capture fisheries production (metric tons),-0.05547373369336128
50,Adjusted net national income per capita (constant 2010 US$),-0.05296383053064346
365,"Persistence to last grade of primary, male (% of cohort)",-0.05258200690150261
1103,Logistics performance index: Overall (1=low to 5=high),-0.05229528248310089
206,"ICT service exports (BoP, current US$)",-0.0519765168428421
751,Incidence of HIV (% of uninfected population ages 15-49),-0.05156000703573227
636,"Employment in industry, male (% of male employment) (modeled ILO estimate)",-0.05098910629749298
557,Total fisheries production (metric tons),-0.0509466752409935
280,Total debt service (% of GNI),-0.05031207948923111
290,"Adjusted net enrollment rate, primary (% of primary school age children)",-0.04965520650148392
358,"Over-age students, primary (% of enrollment)",-0.049313224852085114
352,"Lower secondary completion rate, male (% of relevant age group)",-0.04901152849197388
517,Marine protected areas (% of territorial waters),-0.04874324053525925
952,Coverage of social safety net programs (% of population),-0.047969967126846313
48,Adjusted net national income (current US$),-0.046882037073373795
292,"Adjusted net enrollment rate, primary, male (% of primary school age children)",-0.04680894315242767
73,Adjusted savings: particulate emission damage (current US$),-0.046413831412792206
953,Coverage of social safety net programs in 2nd quintile (% of population),-0.046364448964595795
1005,"Self-employed, total (% of total employment) (modeled ILO estimate)",-0.0461164191365242
861,"Probability of dying at age 5-14 years (per 1,000 children age 5)",-0.04610951989889145
104,External balance on goods and services (current LCU),-0.044998813420534134
743,External health expenditure (% of current health expenditure),-0.04477311670780182
317,"Educational attainment, at least completed lower secondary, population 25+, male (%) (cumulative)",-0.044727060943841934
1068,"Bound rate, simple mean, primary products (%)",-0.04443226754665375
821,"Population ages 60-64, male (% of male population)",-0.043716445565223694
1161,Travel services (% of commercial service imports),-0.04348162189126015
997,"Labor force with basic education, female (% of female working-age population with basic education)",-0.043025217950344086
738,"Domestic general government health expenditure per capita, PPP (current international $)",-0.04287092387676239
40,Rural population living in areas where elevation is below 5 meters (% of total population),-0.040729060769081116
812,"Population ages 45-49, female (% of female population)",-0.0387071818113327
301,"Children out of school, primary, male",-0.037347324192523956
596,Net domestic credit (current LCU),-0.0373348705470562
4,"Agricultural machinery, tractors",-0.03723449632525444
405,"School enrollment, secondary (gross), gender parity index (GPI)",-0.03705695644021034
955,Coverage of social safety net programs in 4th quintile (% of population),-0.035427164286375046
460,"Electricity production from renewable sources, excluding hydroelectric (kWh)",-0.03484660014510155
1070,Commercial service imports (current US$),-0.03481878340244293
915,Adequacy of social insurance programs (% of total welfare of beneficiary households),-0.034262411296367645
329,"Educational attainment, at least completed upper secondary, population 25+, male (%) (cumulative)",-0.033753521740436554
869,Risk of impoverishing expenditure for surgical care (% of people at risk),-0.03321469575166702
818,"Population ages 55-59, female (% of female population)",-0.03319646418094635
819,"Population ages 55-59, male (% of male population)",-0.033160965889692307
1169,Urban population growth (annual %),-0.032838255167007446
813,"Population ages 45-49, male (% of male population)",-0.03250708431005478
364,"Persistence to last grade of primary, female (% of cohort)",-0.03241928666830063
569,"Borrowers from commercial banks (per 1,000 adults)",-0.03159796819090843
464,Energy use (kg of oil equivalent per capita),-0.03142399713397026
868,Risk of catastrophic expenditure for surgical care (% of people at risk),-0.031123068183660507
1017,"Unemployment with intermediate education, male (% of male labor force with intermediate education)",-0.030703067779541016
944,"Contributing family workers, total (% of total employment) (modeled ILO estimate)",-0.030622143298387527
200,Households and NPISHs Final consumption expenditure per capita (constant 2010 US$),-0.03049653209745884
1040,Poverty gap at national poverty lines (%),-0.02980642020702362
794,"Population ages 10-14, male (% of male population)",-0.02897816151380539
374,"Primary education, pupils",-0.027911579236388206
300,"Children out of school, primary, female",-0.0278104729950428
122,"Foreign direct investment, net outflows (BoP, current US$)",-0.0266517773270607
703,Adults (ages 15+) newly infected with HIV,-0.026650190353393555
282,"Total reserves (includes gold, current US$)",-0.026170650497078896
890,Fixed broadband subscriptions (per 100 people),-0.026158474385738373
187,Gross savings (% of GDP),-0.025734230875968933
1090,"International tourism, number of arrivals",-0.025365343317389488
911,Secure Internet servers,-0.024801230058073997
956,Coverage of social safety net programs in poorest quintile (% of population),-0.024690598249435425
787,"Population ages 0-14, female (% of total)",-0.024621637538075447
409,"School enrollment, secondary, male (% net)",-0.024230554699897766
1067,"Bound rate, simple mean, manufactured products (%)",-0.022724611684679985
42,Rural poverty headcount ratio at national poverty lines (% of rural population),-0.021644193679094315
817,"Population ages 50-54, male (% of male population)",-0.021637028083205223
603,Real effective exchange rate index (2010 = 100),-0.021471399813890457
30,Land area (sq. km),-0.02124812640249729
553,"Renewable internal freshwater resources, total (billion cubic meters)",-0.01996457763016224
1033,Income share held by lowest 10%,-0.018739208579063416
789,"Population ages 0-14, male (% of total)",-0.018116626888513565
120,"Foreign direct investment, net inflows (BoP, current US$)",-0.018087925389409065
493,Aquaculture production (metric tons),-0.01751575618982315
815,"Population ages 5-9, male (% of male population)",-0.017019104212522507
222,"Inflation, consumer prices (annual %)",-0.016934392973780632
814,"Population ages 5-9, female (% of female population)",-0.01644149050116539
425,"Tertiary education, academic staff (% female)",-0.015925781801342964
1043,Poverty headcount ratio at $5.50 a day (2011 PPP) (% of population),-0.015583464875817299
166,Gross capital formation (constant LCU),-0.015558799728751183
1111,Merchandise exports to high-income economies (% of total merchandise exports),-0.015532359480857849
566,Bank capital to assets ratio (%),-0.015530545264482498
100,Exports of goods and services (current US$),-0.01525231171399355
237,"Net errors and omissions (BoP, current US$)",-0.014317132532596588
954,Coverage of social safety net programs in 3rd quintile (% of population),-0.013791816309094429
355,Net intake rate in grade 1 (% of official school-age population),-0.013762236572802067
43,Surface area (sq. km),-0.01372632198035717
1129,Merchandise imports from low- and middle-income economies in South Asia (% of total merchandise imports),-0.013322468847036362
693,Women who believe a husband is justified in beating his wife when she argues with him (%),-0.012455455027520657
194,Gross value added at basic prices (GVA) (current US$),-0.011741844937205315
732,Diarrhea treatment (% of children under 5 receiving oral rehydration and continued feeding),-0.011397693306207657
47,Adjusted net national income (constant 2010 US$),-0.01112284790724516
15,Arable land (% of land area),-0.010778412222862244
214,"Imports of goods, services and primary income (BoP, current US$)",-0.010463309474289417
123,GDP (constant 2010 US$),-0.0102751599624753
366,"Persistence to last grade of primary, total (% of cohort)",-0.009789185598492622
208,"Imports of goods and services (BoP, current US$)",-0.009525975212454796
473,Methane emissions in energy sector (thousand metric tons of CO2 equivalent),-0.009163864888250828
94,Exports of goods and services (% of GDP),-0.008940935134887695
905,Public private partnerships investment in transport (current US$),-0.008812915533781052
191,Gross value added at basic prices (GVA) (constant 2010 US$),-0.008411400020122528
9,Agricultural nitrous oxide emissions (thousand metric tons of CO2 equivalent),-0.007985768839716911
507,CO2 emissions from transport (% of total fuel combustion),-0.007780039682984352
421,"Secondary education, teachers (% female)",-0.007536072283983231
771,Number of deaths ages 5-14 years,-0.007319224067032337
904,Public private partnerships investment in energy (current US$),-0.0071874456480145454
829,"Population ages 65-69, male (% of male population)",-0.007145356386899948
729,"Current health expenditure per capita, PPP (current international $)",-0.0066709984093904495
704,Age dependency ratio (% of working-age population),-0.006501819938421249
172,Gross domestic savings (current US$),-0.006474364548921585
377,"Primary education, teachers (% female)",-0.006356016732752323
106,External debt stocks (% of GNI),-0.00542164221405983
60,Adjusted savings: education expenditure (% of GNI),-0.005132406949996948
802,"Population ages 20-24, female (% of female population)",-0.004952607676386833
511,Disaster risk reduction progress score (1-5 scale; 5=best),-0.004553947597742081
199,Households and NPISHs Final consumption expenditure (current US$),-0.0030115973204374313
1107,Merchandise exports (current US$),-0.0025610625743865967
367,Population ages 0-14 (% of total),-0.002556813880801201
34,Rural land area (sq. km),-0.002098027616739273
68,Adjusted savings: net forest depletion (% of GNI),-0.00027628708630800247
368,Population ages 15-64 (% of total),-0.00025169618311338127
108,"External debt stocks, total (DOD, current US$)",0.0003314707428216934
33,Permanent cropland (% of land area),0.0003774315118789673
408,"School enrollment, secondary, male (% gross)",0.0005189143121242523
1126,Merchandise imports from low- and middle-income economies in Europe & Central Asia (% of total merchandise imports),0.0006937757134437561
706,"Age dependency ratio, young (% of working-age population)",0.0012862985022366047
13,"Agriculture, forestry, and fishing, value added (current US$)",0.0013092197477817535
640,"Employment to population ratio, 15+, male (%) (modeled ILO estimate)",0.00141100212931633
1156,"Time to import, border compliance (hours)",0.0019669844768941402
540,"People using at least basic sanitation services, urban (% of urban population)",0.0020352827850729227
189,Gross savings (current LCU),0.0021877314429730177
906,Public private partnerships investment in water and sanitation (current US$),0.0023449845612049103
132,GDP per capita (current US$),0.002632204443216324
526,Nitrous oxide emissions (thousand metric tons of CO2 equivalent),0.0032350830733776093
114,Final consumption expenditure (current US$),0.0032846201211214066
1162,Population density (people per sq. km of land area),0.003314252942800522
917,Adequacy of social safety net programs (% of total welfare of beneficiary households),0.003638405352830887
836,Population growth (annual %),0.00383971631526947
745,"External health expenditure per capita, PPP (current international $)",0.004152480512857437
1044,Poverty headcount ratio at national poverty lines (% of population),0.004512717016041279
77,"Agriculture, forestry, and fishing, value added (current LCU)",0.004560287110507488
185,Gross national expenditure (current US$),0.0047201355919241905
889,Fixed broadband subscriptions,0.005326613783836365
791,"Population ages 0-4, female (% of female population)",0.00568876788020134
